{
  "VAT_ID": "FI24681357",
  "Administrative_Unit_Name": "Teemun Tomaatit Oy Tampere Operations",
  "Administrative_Unit_Type": "head_office",
  "Administrative_Unit_Address": {
    "thoroughfare": "Tomaattikuja 7",
    "post_code": "33100",
    "post_name": "Tampere",
    "admin_unit_L1": "Pirkanmaa",
    "admin_unit_L2": "Finland"
  },
  "Validity_Area_Limitation": [],
  "Validity_Period": [
    {
      "VAT_ID_start_date": "2020-03-15"
    }
  ],
  "Economic_Activity_Type": [
    {
      "Economic_Activity_Type_Nomenclature": "NACE",
      "Economic_Activity_Type_ID": "01.13",
      "Economic_Activity_Type_Description": [
        {
          "Language": "en",
          "Description": "Growing of vegetables and melons, roots and tubers"
        },
        {
          "Language": "fi",
          "Description": "Vihannesten ja melonien viljely"
        }
      ]
    }
  ],
  "Economic_Operator": {
    "EUID": "FIHPR.2468135-7",
    "Economic_Operator_Name": "Teemun Tomaatit Oy"
  },
  "Issuer": {
    "Issuing_country": "FI",
    "Issuing_Organisation": "Finnish Tax Administration",
    "Issuing_date": "2026-04-21",
    "Attestation_issuing_Organisation": "Finnish Tax Administration Digital Credentials Service"
  }
}